Platform,Best_For,Key_Features,User_Limit,Main_Limitations,Cost
Slack,Professional team messaging,"Channels, DMs, 90-day history, 5GB storage",Unlimited users,"90-day message history, 10 app integrations",Free
Microsoft Teams,Enterprise collaboration with Office integration,"Unlimited chat, 60-min meetings, 5GB storage",Unlimited users,"60-minute meeting limit, 5GB storage per user",Free
Discord,Always-on voice chat and gaming communities,"Voice channels, screen sharing, unlimited use",Unlimited users,"Gaming-focused interface, limited business features",Free
Google Chat,Google Workspace integration,"Real-time messaging, Google Workspace integration",Unlimited users,Requires Google account,Free
Zoom (Free),Video conferencing with team chat,"Video meetings (40-min limit), team chat, whiteboard",100 participants in meetings,40-minute meeting time limit,Free
WhatsApp Business,Customer communication & business messaging,"Business profile, automated messages, broadcast",Unlimited contacts,Limited to business messaging features,Free
Telegram,Large communities and broadcasting,"Groups up to 200K, channels, 2GB file sharing",Unlimited users,No voice/video calling in groups,Free
Element (Matrix),Privacy-focused decentralized messaging,"End-to-end encryption, self-hosted option",Unlimited users,Requires technical setup for self-hosting,Free
Rocket.Chat,Open-source team collaboration,"Unlimited chat history, video conferencing, E2E encryption",50 users (Starter plan),50-user limit on free tier,Free
RingCentral Video Pro,Complete free messaging solution,"Unlimited users, 100-participant meetings, file sharing",Unlimited users,No advanced enterprise features,Free
Pebb,Comprehensive team communication hub,"Live news feed, employee engagement tools",Unlimited users,"Newer platform, limited track record",Free
Twist,Async communication and threading,"Threaded conversations, calm messaging",Unlimited users,No built-in voice/video calling,Free
Flock,Team messaging with productivity tools,"Team chat, video calls, productivity integrations",Unlimited users,No advanced reporting in free version,Free
Zoho Cliq,Business messaging with Zoho ecosystem,"Team chat, 100-person video calls, 100GB storage",Unlimited users,"10,000 message search limit",Free
Bitrix24,CRM-integrated team communication,"Team chat, CRM, project management",12 users (free plan),5GB storage limit,Free
Chanty,Simple team chat and task management,"Team chat, task management, unlimited history",Unlimited users,"10,000 message history",Free
